contents,star
"Honestly I have never written a review for any game before, but as soon as I opened the app it was so terrible I had to. Firstly, no tutorial?? If your gonna make a game at least show me how to play. Also there's way too many ads, the game is barely playable. Graphics are bad, absolutely no music, and makes you feel bad when you finally run put of lives. Bad game do not recommend.",1
"Just plain bad. The premise is unique, so terrible trying to be ""not like the other games"". No ads, so of course it's awful because I can't watch my precious ads. It provides a challenge, which is completely heinous because I need everything handed to me. One good thing about it though is that there's no way to get back to the menu when you play. But that doesn't take away from the absolute awfulness of this game. DO NOT PLAY!!!",1
"It gets boring after playing it for some time. It is a classic arcade game therefore the game is infinite play, have multiple lives, no story and easy to learn. It is lacking in background music; background music is important in a game. It sets the mood in the game, and it adds and establish a more engaging experience. Overall, the game is not that good, and its not that bad either.",1
"The gameplay concept could've been good as a time-killer arcade game, but as it is now, the gameplay experience is not very enjoyable. The colors are eye-straining, the GUI is very basic, and the SFX can get annoying after a while. Overall, the objective of the game has potential, but these aspects hinder it from reaching its full potential.",1
"(Alec Rogel Ramos of BSCS221A) I have played the game for less than 20 minutes and I have to say... This game hurts my eyes. The gameplay is simple and repetitive, with its difficulty increasing very subtly. The background is plainly white and combining it with moving colored tiles makes it difficult to focus. There is no tutorial mode to teach you want to do and what to expect to the game, and I happen to stumble upon a bug where the color palette of the tiles changed, making it difficult.",1
"It is no good at all. I kind of hurt my eyes by playing longer. There were a lot of things that were needed, like an instruction manual. Another is that the display is not good, and the next screens are just plain white and the color boxes strained my eyes. Another, I think, is one game mode that is not challenging because they just depends on speed on how users make wrong move to lose a life. The sound effects kinda too simple. Overall the game needs a lot of improvement to make it enjoyable.",1
"The game is poorly designed, with eye-straining colors and lack of background design and special effects. It lacks clear instructions and gameplay guidance, making it unappealing. In terms of difficulty, it is not progressive unlike other games where it get harder overtime. There are minor issues with box responsiveness to taps, occasionally registering either too few or too many. Despite these drawbacks, the game has potential for addictiveness but fails to stand out and becomes dull quickly.",1
"This was definitely an experience of all time. I'm still dizzy from the eye-strain from the colors and the eventual speeding up over time as I gained a higher score. My brain ended up stalling every once in a while trying to match while it scrolled faster and faster. Colors have lost their meaning at this point. I still don't fully understand how the scoring works. Terrible experience, made even worse that I started my day off with this. Thanks. I need a nap. -German, BSIS221A",1
"The game is interesting, i don't know that to expect the first time I'm playing. It's great that the game include on and off audio settings. After playing quite a while my eyes started to hurt becauss of the bright colors, maybe change some colors that you were using, like make it dark if the background is light and vice versa. My mind enjoyed playing the game, a great exercise for hand and eye coordination.",2
"I give the game a 1 star rating because it lacks details that a game must have: 1 - It doesn't have a direction/instruction on how to play the game. 2 - When the game goes faster and when a color is pressed, sometimes it doesn't register in which that should've added 10 points to my score. 3 - The point system stays the same as the game progress, it would be interesting if the game could give a bigger point if I clicked the right color as the game goes faster and faster",1
"The game lives up to its ratings, as every aspect of it is boring and underwhelming. The visuals in the game are uninteresting because of it's simplicity, with the bright white background being displeasing to look at for extended periods of time. The gameplay also feels tedious and lackluster, as you aimlessly tap on boxes until you make three mistakes. Lastly, the game is very forgiving as you are granted additional lives when one is lost, making it harder to lose. - Kyle De Mesa, BSIS221A",1
"This app truly lives up to its name, which is the lowest rated app here in the Play Store. Thank you, devs, for creating a game that never fails to disappoint. The game lacks sufficient challenge, as you can play it endlessly while the app is open without interacting with it. Additionally, the game's settings are quite uninspiring, starting with its plain background, lackluster textboxes, and irritating beeping sound effects.",1
"The gameplay is tedious and annoying as hell, it's repetitive and gives no sense of achievement at all even after getting a high score. Playing this felt more like doing a chore than playing an actual game. Although, it's important to note that the game developers intentionally designed the game this way as part of their concept: ""lowest rated app.""",1
Rated one star because that's what the devs wanted. Real rating: 2 stars. It lacks variety in its gameplay and can even be an eyesore when playing it long enough. Adding variety like different types of shapes and said shapes coming out from different directions could make the game more challenging and keep the players interested longer.,1
"The game was boring after playing for half an hour. The color choice and graphics was eye-straining and made me dizzy. It had no instructions on how to play the game. When it gets fast, sometimes it doesn't register when I click it. But if we're talking purpose I would give it 5 stars as it served it purpose to be a ""One Star App: Lowest Rated App"".",1
"In general, this app's design is missing several elements that users typically seek. Furthermore, after a game session, the display of scores can be confusing for many users, and the overall design is not visually appealing. As a suggestion for improvement, player lives could be reduced when a player fails to click the correct colored box. - Justine Corpuz BSCS221B",1
"Definitely deserves a 1-star rating. I applaud the creators 👏👏👏 They did an extremely good job of making this game suck. The colors of the tiles are very eye-straining. The sound they make is also very annoying. There are also no instructions, so it took me a couple of tries to understand how the game is played. I also like (hate) that you don't die when you miss a tile; it took away the extra challenge that could have made this game last a day on one's phone.",1
"FressyVelasco-BSIS221A The game was fun when you were inactive, but after a while, it became uninteresting to play. I recommend that you work on the level design so that you may add a twist to the game that will unexpectedly test the player. This will help the player stay focused and enjoy the game because everyone enjoys an unexpectedly difficult challenge that will excite them. Additionally, enhance the visual appeal to make it more pleasing to the player's eyes.👍",3
"The game would be better if there has something to do with it. As the state of the game right now, its just too repetitive and does not end even if you do not do anything. I also wish for you to add more quality art and some better music too. I would also recommend having the background of the menu be something else that pairs with the game.",1
"The game is quite interesting to discover, but still lacks of clarity in terms of how it is to be played. That is the most crucial factor in a player's interest and the game seems to have failed to do it. The interface also lacks a bit of technology in terms of its design and appearance. The game can reach its maximum potential if these factors are considered. -Matthew Macasojot, BSIS221A",2
"The gameplay is mediocre but not terrible, it gets harder as you play it longer, but it is also quite forgiving. The moving boxes occasionally record the tap twice, which is a small issue given that you may skip the tapping. Because it's what the developers desire, I'm giving it one star. -Lorica, Zenryc BSIS221A",1
"This is no doubt one of the worst apps made on purpose. The menu backgrounds is a random blured image that has nothing to do whatsoever with the game it has. The start menu is so plain as it only had 2 buttons, the start and mute button. When it comes to the gameplay it was merely challenging as letting the color blocks through didn't consume lives. After playing the game you get booted back to the menu and the start button now says ""Play again loser"" which taunts users to rate the app 1 star.",1
"it was a good game it was a challenging pat because your the one who will discover how the game works and it is intriguing and unique the title alone generates curiosity. My suggestion only is that change other color because it was too bright and add music because music is shaping the overall player experience, evoking emotions, enhancing storytelling, and creating a sense of immersion in the game world.",5
"There are no useful visual cues that can tell me what am I getting into. The title, logo, and menu of the app do not tell me what is the game all about. Especially if you go into this blind without reading reviews or seeing the app preview (like what I did). The menu does not even tell you to play the game at all. After playing continuously for about 10 minutes, my eyes get strained very easily not because of the faster pacing but of the high color contrast between blocks and the white bg.",1
"At first, the game was quite interesting as it makes your brain work and think what color corresponds correctly to the name written on the block. After a while, it gives a heavy strain to the eyes and makes you feel dizzy. One star is very much appropriate for this app, not only were the graphics and design were bad, there is also no goal that made replaying the game worth it after playing it once. - Macawile, BSCS221A",1
"The title of the game speaks for itself, from the menu/interface being sloppy to the repetitive and bland gameplay. The only positive factor that a player can gain in playing this game is that it can help them improve their focus and eye coordination. Other than that, the game is boring and lacks elements and details that is essential in creating a good game. But still, the gameplay was intended to achieve the purpose to create the lowest rated application. Marc Luis Macabuhay, BSIS221A",2
"The game was very boring and plain it's like I'm playing just to waste my time. I think it needs a lot of improvement like adding some gameplay, background music and visual effecfs. Overall the games was good at first but after that it's really boring. I hope the dev will improve their game so people can appreciate their work.",1
"The first thing I would do is enhance the core gameplay mechanics to make them more engaging and challenging. For instance, I could introduce combo systems that reward players for tapping colors and matching tags quickly in succession. next he User interface: I would work on refining the user interface to ensure it is intuitive and user-friendly. For example, I could implement a clear and visually appealing color. BSIS - 221A FIEDALAN MARK JOVEN P.",5
"I'll rate this 1/5. The game is not good and not a user-friendly. It has unresposive controls and double-tapping. This game is chaotic and mess. It got my eyes hurt because of the poor visual design and color, lacks as enjoyable start and there is no clear instruction or mechanics how to play this game.The developer should improve this a lot.",1
"It would be more challenging if missing the right block takes one life, occasionally changing the background color and changing the rhythm of the background music/sound effects will increase the tension of the game. PS. I only rated 1star because the game description said rate only 1star.",1
"The game is simple but it bores me too fast. A break would've been nice to keep the player entertained while being challenge as the game gets harder and harder. It would be nice if the game introduce itself first, I had no idea what to do the first time I played it. Overall, gameplay is good yet needs a tweaking. Could've add more graphics to make it more appealing. -Gabriel Elepaño, BSCS221B",1
"In my book, this game's a snooze. The graphics? Meh, they're like someone slapped together pics and words without much thought. And the audio? Don't get me started; it's just a jumble of random sounds. Worst part? No tutorial. I spent the first few minutes clueless, had to read the Play Store description, and even that left me puzzled. This game's a head-scratcher, for sure. -Espiritu BSIS221A",1
"After playing the game, i came into a conclusion that its just nothing else to do in the game just a plain simple color game with no depth, i would like some powerups in the game or some sort of next level but there is none. all in all it's boring and made my head hurt by the colors in the game",1
"I think this game is okay, but also it needs a lot of improvements in terms of entertainment because it has no twist and other quest unlike the other games. But for me this is a good game and when I play this game, I happily enjoyed the game and at the same time I had difficulties because the longer you play the game, the harder it gets. -(Raven L Atienza, BSIS 221A)",3
I rate it as 1 star for the game itself. While 2/5 for it being a bit challenging and the fact that it actually helps us to give our brains a challenge. 1 star for the menu as it is super plain nothing else on it. Very good title as it actually tells you what the game is all about. A One Star App! Overall 1/5 for everything. Cool idea but very lacking - Carl Mercado BSIS221A,1
"This game really does deserve a one star, the gameplay easily gets boring after a few tries. The game gives no instructions on how to play the game making it confusing when you first played the game, bright gameplay background and you will easily get unfocused when the tiles gets faster because of it. This game achieved it's purpose to be rated one star",1
"The game is not interesting for me personally. Firstly, it does not have any story whatsoever and secondly there is no clear goal on progressing in the game. It really lacks information during the gameplay on what is the game’s overall direction.",1
"I will give this game a 1/5 rating because there are a lot of areas that need improvement, such as the UI design, gameplay, responsiveness, and other features. The game is quite boring, but I believe that it has potential if they make some changes. - Llorente, Rosell (BSIS221A)",1
"I enjoyed the game at first, yet as time goes by the game became boring and the graphics were very painful in the eyes. The Errors within the game and the constant recovery of the lives makes it seem endless and very dreading.",1
"To be honest, this game is not really challenging at all. Also it hurts my eyes while playing it for too long because the background is just plain white. I also don't think the words/captions are not appropriate for the players because In creating a game u must convince the players to play more.",1
"Game is interesting, but the gameplay can be straining to the eyes. The lack of a proper background music seems like a complete missed opportunity.",1
"Truly is the worst game ever in the play store. Props to TMM Labs for having this goal and actually achieved it. On a technical standpoint, the background and scrolling of the game itself is quite an eyesore and didn't really give the players a clear goal or how the game should be played but it was pretty straightforward. -Paul Andrei Datinguinoo|BSCS221B",1
"The game gets repetitive and boring really quickly.There are no other challenges or achievements to have.But it was a good experience and fun for a couple of min,it aslo enhance quick-thinking skills,which is the good part of the game.Just for the sake fo the rating,I'll say I hate this game,this game makes me mad and hurts my eyes why would anyone makes this game, is just the soul purpose is to make people angry.Plus some of the tiles don't work when clicked,so I'll give it a 1 star.",1
I had a very bad experience because why is there no ads popping up whenever you start the game and the tiles are moving so slow it should be moving way faster to the point that my eyes cannot follow it.,1
"One star because it was repetitive and didn't live up to expectations beyond being the worst game ever. The game need more features, or at the very least, more mods to keep it engaging for longer.",1
"This game that lacks visual creativity, it needs user interface and better lighting so that the players will somehow continue to play the game. Overall it's boring since this game have no elements that the players needed to feel.",2
This game is repetitive and boring. Made me almost fell asleep when I tried playing it for 30 minutes. This game has lack of challenges and unique storytelling which makes it boring.,1
"The game was originally designed to troll players, which is why it's called One Star App. However, despite this, I still find the game fun and interesting because it exercised my brain through the challenges presented by the game.",1
The gameplay is not good and lacks quality and user satisfaction. It has poor interface and boring designs. There's hardly a challenge to it.,1
"After playing it for less than 20minutes, I've come to a conclusion that playing this game is fun if you have friends to compete with but playing it solo is boring. There's not much gameplay and it hurts my eyes and brain.",3
"It is a good game. It can help us to improve our reflexes and reaction, but I think needs a little improvement in design because it is too plain. - Ronwell Carcer",1
Kurt Valderama - BSIS221A I rated it 2/5 since the gameplay is not that good. It does not have enough punishment for your lives throughout the game and it gets boring the longer you play it. It also lacks animations and visuals to make the game look more appealing.,2
Worst game ever created. First of all. The graphics are just too good. Second of all. No ads. Third. No tutorial. I wish I could rate the 0 stars but Google won't let me.,1
"The graphics were just too painful to the eyes as the game progresses. The game has no instructions and tutorial. This game was too easy to play. Even if it is a bad game, I still enjoyed it at first.",1
"The game isnt interesting at all, your goal is to make this a lowest rated app and i guess your winning in that category. Thats it, theres no point to play this game again but i want you to make/develop a game with a one star app: but as ""Highest Rated App."".",1
"The game is actually good for the memes, it can be better with a more fitting font and better designed UI, the game mechanics needs polishing, i mean it still okay to be a better game evem if it needs to be one star for the memes hehe, or u can look the other way and make it worse. Eithrt way it can always be better :3",1
"Angeles, Veronica Luisa - BSIS 221A for me i suggest to have a twist in each level because every players wants the game to be more exciting and thrilling and giving scores is not that high even you played it for a straight 20mins and I suggest to give an action to that, but overall its a good game for kids.",3
"the game wont give a sec to analys once you hit the start you start, it doest have instruction plus the sound is annoying, but the game is good for color blind individuals.",2
The game tries so hard to make it a one star app they just throw random bs just to make it bad. it's a big waste of time cuz there is alot of code errors they made. It is boring and no point in playinf this game. 5/5,5
"The game has no sense of gameplay and the visuals are plain and simple and the interface of the game is not really helping for users, the developers should show how the game works",1
"the name is right 1 star app, it's very boring to play and not enjoyable it lacks graphics and it hurts the eyes while it's getting faster and faster, I'll give it a rating of 2/10 it's a waste of effort when making the game if I only put 0",1
"The game is irritating and insulta me when I lose. Its a challenging game with a simple concept. It lacks appeal that many games have. LAMASAN, BSIS221A",1
"This app lives up to its name ""One Star App"". The Game is easy, you'll get bored after a few tries. There's no instructions on how the game works. The Graphics is bad. This app deserves one star rating.",1
"1 star for the creativity and it is like a sending a message game that wants 1 star, its a good workout for the brain but it becomes really boring really fast basic menu, basic gameplay, loud sounds this game deserves 1 star. Tagapan, Aaron BSIS-221A",1
"I'd say the game is pretty boring after awhile, not a lot of stuff that keeps you entertained. The gameplay loop stays the same and not very challenging",1
"This game really lived up to its name, “One Star App”. The game idea was good for me being someone who likes to play apps that is brain teasing but this game is a complete bore. Masyadong simple ang graphic design at masakit din sa mata at the same time, lalo na nang sinubukan kong tutukan ito ng maigi para makita ng ayos ang mga text. Very confusing din dahil walang instruction on how it should be played. A not recommended one for me. — Peria, BSCS221A",1
"To make an intro, its a very very bad game. However, that's the point of the devs based on the title of the game. So in short, this game is just a big waste of time and just don't play this game.",1
"Experience will be how it was advertised, the game is under-developed and requires multiple reconsiderations to improve gameplay and user interaction towards the app.",1
"This game lived up to its name, it really is a ""One Star App"" it's boring for me and really not enjoyable. It can still be improved in many ways but it is a long way to go for this game to be good.",1
"The game was repetitive and boring, as there were no changes in difficulty over time. Also, the graphics were underwhelming and hurt my eyes while playing, and I felt nauseous after the game. Moreover, there is no sense of achievement after playing it as there are no effects to set the ambiance (even the sound design is barely pleasant). The gameplay is pretty nice, and if only the game design became better, it could be quite an entertaining game.",1
Please do not play there are no adds and no in apps and because of that it's hot garbage but really I would rate it a -5 stars (ha JK it's actually pretty good would rate 4.5 stars but the app demands the rating so 1 star),1
"After playing the game for relatively 20 minutes, I would say that this is the most boring game I have ever played. The gameplay was super simple and not much variety to it, there are no instructions or tutorial on how the game is played, the colors and graphics are eye-straining, and there was no music to keep the players immersed and hooked. However, it definitely lives up to its name and purpose of being the ""Lowest Rated App""",1
It's a pretty boring game considering it's purpose; a time killing game. But improvements can be made.,1
"Too plain and boring to play needs more improvement like the background music like need to be more fun and hype to listen to, also the game itself is really boring",1
"The game is challenging but after you play a couple of minute it is started to hurt in the eyes. -Dayo, Erienel",1
I RAGE QUIT!!!😡😡😡 This game was absolutely HORIFFIC this only feature was a game that you could not SUCCEED it was the most horrible app I've ever gotten. DO NOT GET!!!,1
The game itself is boring and plain it really needs improvements both ui and the gameplay itself.,1
It does nothing I thought it worked like a game instead it just shows blocks moving and after that it's says play again 😡😡😡,1
"Really fun game, no adds, no tutorial,bad graphics I wish i could rate in - but i can't",1
"Would give this half a star if I could, to be honest. Ang maganda lang rito ay pinanindigan talaga nila ang ""lowest rated app"", so props to them for their dedication. Ang boring niya, slight nakakairita ang sound when you tap the right boxes/colors, the interface is an eye sore, and when the game's over, mapapa ""yun na yun?"" ka na lang. Tried this once, and will not try again. -Gonzales, BSCS221A",1
"The game itself isn't terrable, but extremely repetitive with what you do. Tap on the colour and the word that says the colour on it, but avoid the wrong word on the wrong colour. Simple, to the point, and repetitive with what you do, even without anything to attempt to spice it up a little bit. What you see is what you get, and I got a game that is the equivalent of putting a toothpick under your toenail and kicking a wall. Hell even thats more eventful than this terrable arcade game.",1
