contents,star
"This game Sucks There's no ads,and if you have fun you have a huge problem. The app is free, bad I like games that cost money. But you should play to see how bad it is and leave another 1 star review.",1
I've never seen an app so perfect in my life. this app is so addictive that i have forgotten about society crumbling around me. when i think about how this world will just eventually end i just come and spend countless hours on this app. its helped me deal with my depression and social anxiety and i wish all of you the best.,1
The amount of ads is outrageous. THERE ARE NONE! What kind of app is this?! Making a simple challenging game that's good for the brain. Unbelievable.,1
I downloaded this app and it nuked my house. And the west side of my city. Zombies ate my family and my phone shattered into a million pieces but it still works it. And then the govenment took me away. But still better than tik tok. Would recomend.,1
Ugh 😫 worst game ever like where's the ads why is it helping me keep track of my memories of colors like I hate this you need ads every one second like compared to other games you need money put ads this sucks so bad but really I kind of like it no I don't hahaha I tricked you haha don't you dare install this app like what is wrong with you is something wrong with your head ug.,1
THIS IS TERBBLE theres no ads and that makes me so angry because everyone knows that there Have to have ads every 10 second and like i could play for hours i should't be able to do that i should be able to play for 1 minute then get bored everyone knows that how are you even still up on this app how!? Its so terrblie dont download it. Its so bad i am deteteing it right now i just cant stop saying how terrblie it is its so bad so bad i highy advise to not download this app never download it 1⭐,1
"the worst and best game ever, just touching boxes with the correct color and text, its ads-free and i need a big ad appearing every 5 seconds that stay at least 2 minutes",1
This game is terrible. It makes my brain hurt and my fingers numb. After playing for 5 mins i had the get my left index finger amputated because of the pain. I will never play this game again in my life!!😡😡😡😡,1
"TERRIBLE!! this blew up my phone, so I had to get a new phone to rate this garbage app! What the hell? When it said ""self destructing now"" I thought it was kidding! Worst development ever. I would give it 0 stars if I could.",1
"Absolutely horrible. Probably one of the worst games I've ever played. The Ads are non existing, and the music sounds like a horse dying.",1
"TERRIBLE APP! My phone literally fell into the pool then it flooded and we died! I recommend not playing this game or it will destroy everything. Oh yeah it has no ads and a really fun game, I hate it. ONE STAR RATE",1
For the developers!!! I hate it my eyes!!! Ugh but 1 star cuz that what the developers want and I confused as heck why SOME people rate it 5 stars like for what to stop the app's purpose? I mean that's what I understand I don't think it's some app that tells you to rate it 1 star but you rate it 5 stars because it goes against the saying or the instructions,1
The game is completely boring. The plainness of this game made it worse. It could irritate the player's eyes with its interface. The game is clearly made just for money.,1
"This game is Terrible. There is no dark mode so it hurts my eyes. And the game is so boring, all you do is click the matching colors at that's it. The game also insults you when it's game over. I never thought I would say this but even gacha life is a better game than this.",1
This app stole mi identity!!!! I was just playing the game and it asks for my credit card number. So I type it in then it asks for my social security number and my full name. Then they have me send my passport to an address. How could this have gone wrong!?!?!,1
"This game is amazing!!!!!!!!! The high quality fonts and the blury backround is so fun to look at and gives me something to stare at during lockdown! You should have to pay lots of money for this app because it is so good! Keep up the GREAT work developers! There are little to no ads in this which makes it a WONDERFUL experience! Definitley an app worth downloading! Don't listen to all the 1 star ratings, this is the best app ever! Thank you developers for an AMAZING experience! Have a good day!",5
"AMAZING!!! 🎈🎉🎊🎈🎉🎊🎈🎉🎊So I played... Expecting what most one star reviews had said, "" IT SUX "". But it didnt. Its pretty smart actually. Its a mind trick that only physcos could never fail or never miss one. I was born to help this great nation by rating this game mindtrick test thing 1 STAR!!!! 💫💫💫💫",1
"During noon, as I was scrolling through the endless void of apps which the algorithm had provided. I spoted a very strange app, as if every fiber of my being called out to it, lusted for it, DESIRED for it. I hesistated. I used all of the willpower in me to contain th-this, feeling. It drove me to madness. I could not bear the thought of not having for so long, so I willed myself to pressing the button of which I desired so long ago. As it started, t-the light i-it's to I can't do thi- 5 stars.",5
"This app is despicable, horrendous, terrible, and garbage. It changed my life. This app is beyond terrible... Its indescribable. Whoever made this game wanted to see me suffer and cry. I would give it 0/5 if I could.",1
It's boring and incredibly repetitive but the controls are responsive and the game actually works. I regretfully have to give it two stars.,2
It's a simple game and made my eye hurt. I suggest to have some power ups to made the game more entertaining but other than that. It lives to it's name and I will support it to become the lowest rated app,1
this app is absolutely TERRIBLE. the game is so simple and fun and it doesn't bombard you with ads every millisecond!! it's also super addicting! i wish i could rate this 0 stars!,1
Omg this was horrible While I was playing an ad comes up about me getting hit in the head with a ball in the. It actually happens! I then fell on the floor and the floor below me broke causing me to fall in a volcano. Worst.game.ever,1
"Best app, changed my life, absolutely amazing. A little self deprecating title and description, way better than expected. Amazing mechanics, super useful, really efficient, runs really smoothly.",5
"Absolutely terrible. No adds, Which is super annoying because I love having adds pop up every 5 seconds. I hate that there's no adds. Would rate zero stars if possible :(",1
THIS IS TRASH!!!!!!I don't mean to be rude but this SUCKS!!!!!It is to confusing it goes to fast and IT INSULTED ME!!!!I am so angry this game is the worst BUT if you just turn the Wi-Fi of there is no adds. Still tho it really sucks and I hate it at first I thought how hard bad could it be but now I realise it absolutely is TRASH!!!!!! I believe you could put a LITTLE EFFORT INTO THIS!!!!!! Also I don't recommend you download this as it even gives you A GLICH IT TOOK MR EVER TO FIX MY iPad!!!!,1
Honestly if I could give it 0 stars I would WHAT TYPE OF GAME DOESNT HAVE ADS. The game is really good and isn't a rip off of any game and trains your brain. This game is so bad. PS. I got a score of 420 lololol,1
This app is absolutly awful if i could give it 0 stars i would like for starters it doesn't have any adds like everyone knows you gotta have at least 7 adds per minute and don't even get me started on the gameplay like it is way too challenging i expect a game to be so simple that even newborns can play it this game is so awful that my mom disowned me for playing it this game is so bad that id rather jump into a pool of pirannahs than play this again,1
Omg it's so bad like omg. No ads like whattttttttt🤔 I need my ads to live. Also an easy to use menu 🤮🤮🤮🤮🤢🤢😡😡😡. The game is actually fun like blegh I want games to be boring and repetative like every popular mobile game. ALSO THE GAME HAS THE AUDACITY TO GIVE A CHALLENGE LIKE WHAAAAAT I WANT MY GAMES TO BE EASIER THAN MAKING A PB&J SANDWICH. ALSO THE GAME SENT MY PASSWORDS TO THE GOVERNMENT TO GIVE ME VIRUSES. (This entire rating is satire and a joke it's actually pretty gud ngl),1
The game should improve on a lot of things including the interface itself. The game is too repetitive and boring (that's the reason behind the title.),1
"this SUCKS!!!!!! i'm warning you, don't download, it gave me no ads, it had a MUTE BUTTON??? like, i have a volume button you dumbass.. and, AND, it's so original and basic at the SAME TIME??!! that's bs! this game is utter GARBAGE!!!!!!!!!!!!!",1
"Game was brilliantly made, not one miserable thought came to mind playing this. As I click on the lovely contrasted blocks of perfection, I couldn't help but feel as if I found the secret to life. This game, no. This paradise of experiences has taught me well. Thank you good sir.",5
"Awful. When I played this it deleted all the apps on my device and proceeded to delete all my memories,in real life and in my device. I have no memory about my life or why I'm rateing this. PLEASE DO NOT GIVE A REVEIW ABOVE ONE STAR.",1
"Terrible game. The gameplay is fun and interesting, and there are no ads. Not even any pay walls! Uninstalling immediately.",1
This game SUCKS!! first. THERE ARE NO ADS!! Like seriously??? Ads make everything better! Second. I HAD TO USE 1 BRAIN CELL!!! THIS IS A WASTE OF TIME IF IT HAS NO ADS AND IF I HAVE TO THINK!!! ugh 😡😤😠🙄,1
Horrible gameplay. There aren't enough ads and it's not lowering my self confidence enough. I would rate it 0. Do not download this EVER. it gave my computer a virus.,1
So I had no idea this app would be such a scam I wanted to play a lovely calming game but was greeted with a game that not deleted everything from my tablet but also hacked all my imformation and now I'm a million pounds in debt. Do not playyyyyyyyyyy. Also I forget to mention this deleted my exist as well thanks for that.,1
What's with the ads?! I was excited that reviews stated there were no ads. I downloaded it and what do I see at the bottom? An ad! Then it called me a loser. Oh yeah? I promptly uninstalled It. Who's the loser now?,1
"This app is so bad, it doesn't deserve a 1 star, it took away my favourite part of all the mobile games, ADS. Its just begging for 5 stars and the controls don't work properly, worse game ever",1
"It was awful! It had like no ads, I had too much fun like ew and I had the worst time on it. 🙄 It was so bad I would rate it a 0 but thats not possible so I give it a 1",1
How come there are NO ADDS!!!!?? Everyone knows that the best apps have ads every 10 seconds and a weekly subscription that costs $40. But this app has none of these. Everyone likes adds and subscriptions and you are ruening everyones fun by deleting these!! 1 star!!,1
"God tear game can't li played it for a solid 16min my max attention span. No other game ever achieved that level. And the ads, there no ads! Was going to put 1 star. Just for the cos but i couldn't stand thinking that i could've helped somebody find and change there lifes. I you reed this i am no longer me. I WAS CHANGED.",5
"Worst game. As soon as I hit play, I was put into a torturous game where I had to dodge blocks. I had to run to the end and hit one star. Im rating this right now to escape. I have to finish this qui",1
It was truly appalling. It was easy to learn yet challenging and fun which is like come on devs we want frustrating dumb games not fun ones.there were also no adds at all we want adds like seriously where's my tacobell advertisement.truly truly horrible download it only to give a 1 star rating😤,1
"Graphic are good, gameplay is satisfying. But have to work on distance loading. Love the feature that you can watch movies as well during off time. It literally have all the movies. Nice app. After playing it you will realise PUBG, Fortnite are just overrated. Great concept & storyline. Keep up the good work 💙",1
It's the worst app ever. Has no ads this is against the rule of mobile games every mobile game should have at least 20 ads per minute. It developed arms and feet after downloading and also gave me a virus.,1
"This app is horrible! Like all the reviews say, there are no ads!? And the app lies to you, saying the possible score but they lie! Everyone should install! I would give this app -5 stars but I can't. I hate this app so much!!!!!!",1
This game was great!! I had one major issue with the app though that lead me to rate this game 1 star. The problem was that this game is not rated 1 star and I have a huge problem with that.,1
"The worst game possible. After downloading this game after thinking the comments are fake, i blacked out and woke up in the middle of a desert in a hole full of rattlesnakes. I managed to get home to my phone, but it had a virus and exploded! Awful game😡😡 DO not DOWNLOAD it will 'ruin' your life",1
"Pathetic game. As soon as I installed it, my laptop, which isn't even connected to my phone, crashed, our building broke down, and I died from breathing too much air. 1/5 stars.",1
"Omg this is such a bad app. *sarcastic* there are like, 500000000000000000000 ads a second. And the subscription is like, 800 bucks a month. I'm kidding. Pretty good game. Challenging.",1
"This is horrible. There was NO instructions on the game WHATSOEVER, which caused me to become frustrated and break my tablet. Now my house is on fire and I have to live on he freeway because of this DUMB APP!!!!!!! Do NOT download unless you are facinated by fire trucks!",1
Worst game I ever played. The controls didn't work and there was so many ads that I couldn't even play it for more then a minute without an ad popping up. Don't install,1
This app is a total nightmare! I just downloaded it via a friend and bro fortnite ain't loading for me. I mean I play fortnite everyday on my phone its a daily routine how can I ever miss playing fortnite at 10 o clock in the night with the boys. Absolutely terrible don't download this app unless you know that you don't want to play fortnite anymore on your device!!!!!!!!!,1
"The game is not good enough. Honestly, i can't stand fames like these. It's really original game and there are no ads. For me, the app is not enjoyable and it does not have anything.",1
The game is boring and unattractive. It needs a lot of improvements specially with the designs and the phasing of the game.,2
"This is the worst game ever. It's not interesting, there's ads every 3 seconds, and on top of all all that, it worked very poorly.",1
"This app is garbage, the most worst YET. IT HAS NO ADS AT ALL, like c'mon. You gotta have ads to make it playable. Why do you do this to yourself? This is a horrible experience. Why do you try?? Don't ever recommend me this AGAIN! I hope your game gets deleted off platforms everywhere. I hate you and your poor excuse of a game. I hope your rest in peace and never come back on earth again. And I mean it. DON'T EVER COME BACK. Do you know how much bones I risked to play this game??? Dislike.",1
Absolutely exceptional User Interface. It beats any app I have ever used. The messages after losing the game are incredibly motivational and it made my day! This app is a gift to humanity! Honoured to be alive at the same time as these great creators! Thank you from the bottom of this unfulfilled heart!,5
I feel like this is the worst app ever created. It has terrible graphics and to be honest the gameplay is just garbage. I really wish I could rate this -5 stars but I can't.,1
"Worst app ever. My washing machine nearly killed me. I have also had non-stop explosive diarrhoea ever since I downloaded the app, we had to move out because the house exploded. My cat became satan after that, AND SHE MADE MY PHONE FREAKING EXPLODE. Do. Not. Download.",1
"This is the worst app. I was playing the game as you would do and I started craving mould. A hand then came out of my phone and force fed me mould. The app then said lol in my face as I was dying. Luckily I died so that I didnt have to live with this app ever again. INSTALL THE APP, RATE IT 1 STAR AND UNINSTALL IT.",1
"This game is very useless, there is no ads and very worst is.. Its to hard to play it, I'm always want to play games that has ads.. I'm so unlucky to play this useless game(HEHEHEHE, I GOT YOU SIR) ;3",1
"Y'all, I downloaded this app then black out as soon as it was done.. I woke up in the middle of the woods and saw Annabelle! 😱 On the other hand the graphics are horrible.. Smh.. 🙄🤡",1
"Pleasantly surprised. Woke up hanging from a crane in Moscow Russia with my phone taped to my face, downloading this app. I thought ""Well, might as well give it a go while I'm up here."" I was wrong. Immediately when I opened the app, I heard screams from the middle of the air, then it stopped. I couldn't see, hear, feel or even think anything. Then out of the blue, what seemed like a raptor-demon-monkey-hippo-eagle in Gru from Despicable Me's voice said, ""You have no idea what you just did.""",1
"It is SO bad I wanna give you a zero, but thats not possable, so I give you, A ONE. I havent played it yet, I just wanted to say it but I hope that in has HORABLE grafics and SO many adds because thats how I like my games.",1
Omg guys do not get this app seriosly. My background just got hacked and my phone started to freeze. Then tons of ads started to pop up and when i tried to oprn my phone it wouldnt turn on.,1
I downloaded this app a while back I think. But all I remember is clicking play. Next thing I know I wake up in some hospital and am told that there's a pandemic going on?? Please help me I'm scared.,1
I hate this game. Why not put ads on it? Make the game easier as well cause its super super hard. I also had fun playing it like what the heck?!,1
"Absolutely horrible. The game is WAY too fun for my liking, like, GAME'S SHOULDN'T BE THIS FUN YOU WEIRDOS?! There's also NO ADS, what is UP with that?! This is the single-handedly worst game I have ever played, eat my one star awesome devs, smh.",1
This is the worst game ever!!! I played a round and their was no ad on the middle of the round!!! I can't believe this!! Ads are my whole life and they took it away from me along with my dad who never came back with the milk!!! 😠 (the game is actually good),1
"I wouldnot even give it a star!!! Its so bad not a single ad, it must have 29470273 ad in 1 sec... the levels are too bad. What the heck is this game? Dont download!!!its bad... (actually its good just was telling as the app told me.)",1
Omg like bruh worst app ever once I installed it there were no adds. I love adds. 2. The game was unbelievablely great! This is moble! The apps are supposed to be so low quality! 3. Yeah install this and find out yourself then give 1 star,1
so like i decided to try some different games and i found this one. i downloaded it but as soon as i started playing my sink flooded. and right after i fixed it my dog bit my leg off!!! DONT DOWNLOAD IT WILL RUIN YOUR LIFE🤬,1
An awful experience but an interesting one. The concept of the gameplay is not that bad. The only red flag of the game is its design.,1
Very laggy and when i oppened the app the app crashed straight away. After that i got an Email thanks for you purchase and lost 200$ dollars. Also after that my phone stopped working.,1
"So terrible. Game is so basic. I also get no ads, which I need. If I can't watch ads, I won't go insane from the amount. Incredibly stupid.",1
"This is a mind game, the dev's just want us to think that the game is bad and then we go into it with low expectations and then we get a bad game but not a God awful one and then we think that the game is crack, smhing my head; 5 stars",1
"I wish there was a 0 star option. This app has way too many ads, is pay to win and extremely laggy. I hate this app with all my heart and I hope it gets removed from the Play Store. /s",1
Horrible. Has horrible graphics too many ads can't even pass the first level. It has bad instructions and it overall is bad.,1
"This actually sucks. I prefer my game with ALL ADD and NO PLAY! I also like games to scam me of my money. But this, oh boy, CHARGES ME NOTHING AND HAS NO ADS! It's not what I wanted and sucks so badly.",1
The worst possible rates game in the whole wide world...!!! No ads....and just to simple all the stages are the same.... lol didnt mean that but love the concept of the game......!!😍😄,1
"This app is horrible right after I installed it it summoned a 69 headed turtle with 420 eyes and no legs in my house 🐢🐢👀👀and made a walrus throw a refrigerator at my late grandma🥶🐸🦑👵!!1!11! My phone couldnt handle such a bad game that wastes a lot of storage space with just coloured rectangles with numbers 🔢 on them, that it threw itself out of the window of the 666th floor at 3AM and landed specifically on a pile of spiky rocks🗿!!!1!1 do not play this game 💀😠💀😵😡😨😬😨😓😭🤯🤒🤬😡",1
"Terrible, the game glitches easily the longer you play it and it doesn't even allow you to click the colors.",1
This app is horrible there is nothing bad about it there is no adds witch there should be at least 69 every 2 seconds. Hmmmm sus. this app is just horrible. (This app is actually awesome),1
I downloaded this app thinking it would quench my boredom but I blacked out and woke up in a warehouse. People were gathered around me chanting 1 star. They held the phone up to my singular finger that was free from the rope and slid the phone under my finger. Then they pushed my finger down onto the 1 star button and then I blacked out and woke up in my apartment. 1/5 stars.do NOT download,1
"Good lord have I never seen such a useless app in all my life. Why does this even exist? I was crying in my room about how bad this app is, then the cockroaches came and asked me why. And I said; ""it doesn't have annoying ads which I love to see"". And when the roaches heard this they all did 200 backflips and died. Also, the game is too impossible. Not even Dark souls is as hard as it. It's easier to move the earth than win the game. 1 STAR!! WORST APP EVER!!",1
"I thought to myself all this reviews were made up, then I downloaded the game, big mistake, my phone screen blacked out, then flashed, then I blacked out, I woke up to Rick Astley's never gonna give you up, I was handcuffed to a chair, it played for hours and hours, and not only that, but I was forced to clean dishes for half an hour straight, then I woke up, then I was attacked by a bear, then I blacked out again a woke up, uninstalled the game, burned my phone, then got a new one.",1
Hate this game so much. There are no ads and I LOVE ads so much. This game is also very challenging. I'm uninstalling it.,1
"The game is interesting and has fun mechanics but still one dimensional, and could use more changes regarding the difficulty of the game",1
"Absolutely terrible. Wouldn't even count as a mobile game if it weren't for the ads. Even then, there weren't any ads my whole playthrough.",1
"Boring and unstimulating , although the foundation of a good game concept is there, it is exhausting and not worth it. The visual appearance and responses further suggests a negative feel.",2
"This is the greatest game to ever exist. This game is so good, its hard to even describe it. The gameplay is thrilling, the graphics are top tier, and, best of all, no ads!!! Nothing can even match the excellent gameplay of this masterpiece. Overall, 10/5 stars. Sincerely, Joe Biden, President of the United States of America",5
"Absolutely horrible game, no ads! Works very fast, it doesn't lag, which is what I like my games to do. 😒",1
"THIS WAS HORRID!!!!honestly the worst app ever,no ads whatsoever,and ads are the game for me!I hate it!also it's free!why can't it cost at least 1000000$!!!!!like seriously 😑!!I don't know why I downloaded it 😑. Hmff.",1
This is the dumbest game ever. There are NO. ADS. I. NEED. ADS. This is also insulting me. It's also boring. Uninstalling. I will not and never recommend playing this.,1
"I expected better, first of all where are the ads ? I'm quite disappointed. Second of all my dog started biting me when i started playing is that normal? 1 star for me never again I DO NOT RECOMMEND",1
"You know... I thought people were being sarcastic with the name, so I downloaded it myself (so gullible), and started playing it for a few minutes until I got bored and tried to leave... But I couldn't leave. Then, next thing I know, Nikocado Avocado's face appears on the screen and I scream super loud. Then I hear loud stomps behind me, and see a giant Nikocado Avocado walking towards me. I had to break my phone to make it all go away. -10 stars. DO NOT DOWNLOAD THIS APP, IT IS SUPER DANGEROUS.",1
"It was terrible their was no ads which made me so sad, and the game is not pay to win so i hate it. The game is not easy but a little challenge so bad.",1
"This game is so bad, if I could give it zero stars I would, but I cant so it gets a one 😡😡. Anyways ALSO it did lemme pay 200 dollars a month for an ad free game THAT STILL HAS ADDS. Ten out of ten would not but again 😫",1
"WORST APP EVER!!! I saw no adds while I played, there was no pay walls, and the level are WAY too hard! Not even Albert Einstein could solve them! Dont get this app but if you do rate it a one star!",1
Horrendous. Opened the app and broke my leg before falling out the window. Then I was fired from my job and my car was vandalised. I cannot recommend this app less. ONE STAR.,1
This app is horrible with a clean easy menu absolutely no ads and a game that's both easy fun and kind of challenging at the same time this app is horrible I wouldn't wish this app upon my worst enemies DON'T BUY THIS,1
